recipe_link,extracted_from_website,methods_used,new_foods_created,added_to_mealie,missing_or_not_found,mealie_link
https://www.aheadofthyme.com/chicken-parmesan-stuffed-peppers,"Name: Chicken Parmesan Stuffed Peppers | Prep: 10 min | Cook: 45 min | Total: 1h 5min | Yield: 8 servings | Description: Delicious, flavorful and filling, combines chicken parmesan and stuffed peppers. Great for meal prep, freezes well. | Ingredients (12): 4 large bell peppers; 1½ cups cooked chicken breast shredded or finely chopped; ½ cup panko breadcrumbs; 1 cup mozzarella grated and divided; ½ cup Parmesan freshly grated; ¼ cup fresh parsley finely chopped; 1 tbsp olive oil; 1 cup tomato sauce or marinara; 1 tsp salt (or to taste); ¼ tsp ground black pepper; ½ tsp garlic powder; ¼ cup water (for baking) | Steps (7) | Notes: How to store (fridge 3-4 days); How to freeze (up to 3 months); How to reheat (350F oven 15-20min) | Nutrition (per serving, serves 8): calories 150, fat 4.6g, saturated fat 1.4g, trans fat 0g, carbs 12.4g, fiber 2.8g, sugar 5.2g, protein 14.7g, cholesterol 26.2mg, sodium 550.3mg","1. JSON-LD: present in page at position ~263188 (before tasty-recipes block) — contained full nutrition. Was missed first pass because search started from the wrong position in the HTML. Fixed. 2. Tasty Recipes plugin HTML: used for ingredients (aria-label on checkboxes), instructions (ol/li), notes (p tags), and header fields (class attributes).",None — all 12 foods and all units already existed in Mealie.,"All 12 ingredients with correct foods/units/notes; 7 steps; 3 notes (storage, freezing, reheating); nutrition (calories 150, fat 4.6g, carbs 12.4g, protein 14.7g, sodium 550.3mg, etc.); categories: American, Chicken, Dinner; image uploaded.",Nothing missing — all data extracted and added.,https://mealie.gruffus.com/g/home/r/chicken-parmesan-stuffed-peppers
https://www.aheadofthyme.com/chicken-pot-pie,Name: Chicken Pot Pie | Prep: 45 min | Cook: 30 min | Total: 1h 15min | Yield: 6-8 servings | Description: Homemade chicken pot pie with creamy savory filling and crispy flaky crust. Stores and freezes well. | Ingredients (19): Pie Crust — 2½ cups all-purpose flour (300g); ½ cup butter cut into ½-inch cubes; ½ tsp salt; ⅓ cup ice water. Filling — 2 tbsp butter; 1 medium onion diced; 1 tbsp garlic minced; 3 medium carrots thinly sliced; 3 ribs celery thinly sliced; ¼ cup all-purpose flour; 2 cups chicken broth; ¼ cup sour cream or heavy cream; 2 cups cooked chicken shredded; 1 cup frozen peas; ½ tsp salt; ¼ tsp ground black pepper. Topping — 1 egg beaten (egg wash); ¼ tsp salt; ⅛ tsp black pepper. | Steps: 15 steps (make crust in food processor; refrigerate; make filling in skillet; assemble; bake 400F 30min; rest 15min) | Notes: How to store (fridge 3-4 days); How to freeze (up to 3-4 months) | Nutrition per serving: calories 362; fat 16.9g; sat fat 9.9g; carbs 40.9g; fiber 3.4g; sugar 3.5g; protein 11.4g; cholesterol 66.3mg; sodium 679.8mg,"1. JSON-LD: present but embedded inside @graph array (not top-level Recipe type) — found by checking all items in @graph. Contained full ingredient list, nutrition, times, yield, description. Instructions were empty in JSON-LD. 2. Tasty Recipes HTML scraping: instructions extracted from ol > li inside tasty-recipes-instructions block (15 actual steps; steps 16-20 were metadata noise filtered out). Notes extracted from p tags inside tasty-recipes-notes block.",None — all 14 foods and all units already existed in Mealie.,"19 ingredients in 3 groups (Pie Crust, Filling, Topping); 15 steps; 2 notes (storage, freezing); full nutrition (362 cal, 16.9g fat, 40.9g carbs, 11.4g protein); categories: American, Chicken, Dinner; image uploaded.",Nothing missing — all data extracted and added.,https://mealie.gruffus.com/g/home/r/chicken-pot-pie
https://www.allrecipes.com/easy-doner-style-kebab-recipe-11871835,Name: Easy Doner-Style Kebab | Prep: 20 min | Cook: 35 min | Total: 55 min | Yield: 6 | Cuisine: Middle Eastern | Ingredients (17): 1 lb ground round; 1 lb ground lamb; 1 onion grated and drained; 1 cup whole milk greek yogurt divided; 3 tbsp olive oil; 2 tbsp paprika; 2 tbsp cumin; 1 tsp coriander; 2 tsp oregano; 2 tsp kosher salt; 2 tsp pepper; 1/4 cup lemon juice divided; 3 cloves garlic pressed; pita or lavash bread warmed; 1 bunch fresh parsley; sliced onion and tomatoes; red chile sauce for serving | Steps (8): preheat 400F; mix meat; roll onto parchment; fold and bake 30-35 min; unroll and optionally broil; make yogurt sauce; serve on pita | Nutrition per serving: 690 cal; fat 37g; sat fat 13g; carbs 39g; fiber 3g; sugar 4g; protein 49g; cholesterol 146mg; sodium 875mg,"1. JSON-LD: present in a single block but @type was a list ['Recipe','NewsArticle'] — fixed by checking if 'Recipe' in @type list rather than exact equality. Contained full recipe: ingredients, instructions, nutrition, times, yield, cuisine, categories, image URL. 2. No Tasty Recipes or WPRM plugin — allrecipes.com uses its own JSON-LD schema.",None — all foods found. Red chile sauce → used 'chili sauce' (closest match) with note 'red chile sauce preferred'.,"19 ingredients in 3 groups (Meat Mixture, Yogurt Sauce, To Serve); 8 steps; no notes; full nutrition (690 cal, 37g fat, 39g carbs, 49g protein); categories: Middle Eastern, Dinner, Lamb; image uploaded.",Nothing missing. Red chile sauce had no exact food match — used chili sauce with note.,https://mealie.gruffus.com/g/home/r/easy-doner-style-kebab
https://www.allrecipes.com/recipe/104850/black-bean-and-corn-quesadillas,Name: Black Bean and Corn Quesadillas | Prep: 10 min | Cook: 30 min | Total: 40 min | Yield: 8 | Cuisine: Southwestern/Mexican | Ingredients (10): 2 tsp olive oil; 3 tbsp finely chopped onion; 1 can (15.5 oz) black beans drained and rinsed; 1 can (10 oz) whole kernel corn drained; 1/4 cup salsa; 1 tbsp brown sugar; 1/4 tsp red pepper flakes; 2 tbsp butter or as needed; 8 (8-inch) flour tortillas; 1.5 cups shredded Monterey Jack cheese | Steps (2): cook filling in saucepan; assemble and cook quesadillas in skillet until golden | Nutrition per serving: 363 cal; fat 15g; sat fat 7g; carbs 46g; fiber 6g; sugar 3g; protein 14g; cholesterol 27mg; sodium 733mg,"JSON-LD via @graph array with @type as list ['Recipe','NewsArticle']. Full recipe data including nutrition, times, yield present. OG image used (JSON-LD image was a video poster URL).",corn,"10 ingredients (no groups); 2 steps; no notes; full nutrition (363 cal, 15g fat, 46g carbs, 14g protein); categories: Mexican, Vegetarian, Dinner; image uploaded.",black beans → used 'canned black bean' (closest match; noted in ingredient). Monterey Jack cheese → used 'monterey jack' (closest match; noted). corn → created new food.,https://mealie.gruffus.com/g/home/r/black-bean-and-corn-quesadillas
https://www.allrecipes.com/recipe/104947/roasted-asparagus-and-mushrooms/?internalSource=hub%20recipe&referringId=16382&referringContentType=recipe%20hub&clickId=cardslot%2021,Name: Roasted Asparagus and Mushrooms | Prep: 10 min | Cook: 15 min | Total: 25 min | Yield: 6 | Cuisine: American | Ingredients (6): nonstick cooking spray; 1 bunch fresh asparagus trimmed; 0.5 lb fresh mushrooms quartered; 2 tsp olive oil; 2 sprigs fresh rosemary minced; kosher salt and freshly ground black pepper to taste | Steps (3): preheat 450F grease tray; toss veg with oil and seasoning; roast 15 min | Nutrition per serving: 38 cal; fat 2g; carbs 4g; fiber 2g; sugar 2g; protein 3g; sodium 84mg,JSON-LD via allrecipes.com standard structure (@type as list). Full recipe data present including nutrition. OG image used (JSON-LD image was a video poster).,None — mushroom already existed (400 on create confirmed it). All other foods found.,"7 ingredients (no groups); 3 steps; no notes; full nutrition (38 cal, 2g fat, 4g carbs, 3g protein); categories: American, Vegetarian, Side Dish; image uploaded.",Nothing missing. cholesterol not provided in source nutrition.,https://mealie.gruffus.com/g/home/r/roasted-asparagus-and-mushrooms
